{"agent_id":"A0","attempt_no":1,"characters":[],"general_notes":"","group_id":"00","schema_version":1,"source_image_ids":["1"],"uncertain":[{"check_conclusion":"Checked disposable reference without match","checked_paths":["refs/arknights/icons/one.png"],"image_id":"1","reason":"Insufficient visual identity information","reference_candidates":[],"review_priority":"high","visible_features":"Visible disposable character evidence"}]}